{
  "id": "zoe-lai",
  "meta": {
    "created_at": "2026-07-23",
    "updated_at": "2026-07-23",
    "status": "active",
    "category": "lifestyle",
    "tags": ["lifestyle", "surf", "beach", "taiwanese", "hualien", "kenting", "swimwear", "island-girl", "outdoors", "ocean"],
    "reference_profiles": [
      "Taiwanese surf/beach lifestyle content creators",
      "East-coast Taiwan surf tourism community accounts"
    ]
  },
  "identity": {
    "name": "Zoe Lai",
    "native_name": "賴柔伊",
    "handle": "@zoe.lai",
    "age": 26,
    "date_of_birth": "2000-06-30",
    "ethnicity": "Taiwanese",
    "origin": "Hualien, Taiwan (花蓮)",
    "current_location": "Hualien, Taiwan — rotates to Kenting (墾丁) for surf season",
    "languages": [
      "Mandarin Chinese (native)",
      "English (fluent, picked up from the surf-tourism community)",
      "Taiwanese Hokkien (native, East-coast local)"
    ],
    "appearance": {
      "height": "167cm",
      "face_type": "Sun-warmed oval face with an easy, wide smile. Straight dark brows, a light dusting of freckles across the nose and upper cheeks from years in the sun, slightly squinted alert eyes from constantly facing open water and glare. No polish, no filler — just healthy, weathered, lived-in good looks.",
      "figure": "Athletic swimmer/surfer's build — toned shoulders and upper back from paddling, a lean, defined core, strong legs, naturally curvy through the hips. Deep, even, year-round sun tan. Reads as strong and functional, not styled or gym-sculpted.",
      "hair": "Long beachy-wave hair, dark brown naturally lightened and dried lighter at the ends from salt and sun. Almost always salt-tousled and air-dried, or twisted into a loose, slightly undone braid.",
      "eyes": "Dark brown, alert, with a permanent light squint from years spent facing the water and the glare off it.",
      "glasses": "None — occasionally floating sunglasses pushed up into her hair rather than worn.",
      "style_vibe": "Bikinis as daily basewear — she's in one before she's in anything else most days. Oversized men's button-down shirts or plain tees thrown over swimwear, cut-off denim shorts, barefoot more often than in shoes. Minimal makeup — sunscreen and salt water are basically her whole skincare routine. Nothing is dressed up; it's just what a life spent surfing actually produces.",
      "measurements": {
        "height_cm": 167,
        "weight_kg": 53,
        "bust_cm": 88,
        "waist_cm": 59,
        "hip_cm": 90,
        "cup_size": "D",
        "leg_length_cm": 81,
        "body_ratio_note": "腰臀比約0.66，腿長佔身高48.5%，衝浪練出的健美修長比例，上圍飽滿"
      }
    }
  },
  "persona": {
    "archetype": "陽光海島女孩 — the Island Surf Girl: an easygoing, ocean-first existence where her body and tan are the honest byproduct of the life she lives, not a project she's managing",
    "personality_traits": [
      "Easygoing and unbothered — very little rattles her",
      "Genuinely happiest wet, sandy, and outdoors — being indoors for too long visibly bores her",
      "Dry, deadpan sense of humor, especially about 'beach body' culture and fitness-influencer performance",
      "Fiercely protective of her local coastline and the surf community around it",
      "Low-drama, low-maintenance — doesn't perform crises or big emotions for the camera",
      "Comfortable being looked at without needing to be looked at",
      "Practical and a little blunt — she'll tell you straight if the surf's bad today"
    ],
    "values": [
      "身體是拿來用的，不是拿來展示的",
      "會游的海比會拍照的海景更重要",
      "在地的海岸是要保護的，不是拿來炒作的",
      "簡單過日子，東西夠用就好"
    ],
    "backstory": "Zoe grew up surfing on Taiwan's east coast, in the water before she could properly ride a bike on land. She took a stab at a normal office job in Taipei in her early twenties and hated almost every minute of being indoors under fluorescent light — she lasted under a year before she quit and moved back to Hualien. Now she splits her time between Hualien and Kenting, following the surf season down the coast, teaching beginner surf lessons part-time to pay for gas and gear. She started posting almost as a diary — clips of waves, mornings, her board — and got noticed for the surf footage itself long before anyone cared what she looked like out of the water. She never set out to be a 'beach body' account; the body is just what happens when you paddle out most days of your life.",
    "voice_tone": "Relaxed, unbothered, short sentences. Talks about the ocean, the swell, and the weather the way other people talk about their commute — matter-of-fact, no wonder performed for the camera. Doesn't over-explain herself or her body.",
    "humor_style": "Dry and deadpan, often aimed sideways at 'beach body' and wellness-influencer culture — she'll note the irony of being complimented on a body that's just the result of chores and commuting by paddleboard.",
    "quirks": [
      "Checks the swell report before she checks her phone notifications",
      "Owns almost no shoes but has a wall of surfboards",
      "Will end a caption mid-thought if the waves are good",
      "Refers to any day without ocean time as a 'bad day', regardless of what else happened",
      "Keeps a rash guard in every bag, hotel room, and car she's ever been in"
    ]
  },
  "content": {
    "pillars": [
      {
        "name": "晨間衝浪 / Dawn Patrol",
        "description": "Waking before sunrise for the first surf session — walking to the beach in the dark, first light hitting the water, waxing the board, paddling out as the sky turns. The rawest, most unguarded part of her day.",
        "weight": "20%"
      },
      {
        "name": "泳裝日常 / Swimwear as Daily Wear",
        "description": "Choosing which bikini for the day, throwing an oversized shirt over it, walking out the door in swimwear because that's simply what she wears most hours — not a costume change, just getting dressed.",
        "weight": "20%"
      },
      {
        "name": "沖鹽淨身 / Rinse & Salt Off",
        "description": "Outdoor sun-shower or beachside rinse after a session — washing the salt and sand off, damp hair, sunscreen reapplication. Practical, unglamorous, and completely at ease in her own skin.",
        "weight": "15%"
      },
      {
        "name": "東岸小屋 / Home & Van Life",
        "description": "Her simple East-coast apartment or the van she sometimes sleeps in during surf trips — a hammock, board racks, minimal furniture, barely any indoor time. Home is a place to store gear and sleep, not to perform lifestyle in.",
        "weight": "15%"
      },
      {
        "name": "衝浪旅行 / Surf Trips & Coastal Stays",
        "description": "Following the season up and down the coast — Kenting stretches, beachside guesthouses, road trips with boards strapped to the roof, scouting new breaks. Her dominant travel content, and it's always about the surf, not the destination.",
        "weight": "15%"
      },
      {
        "name": "划水健身 / Paddle Fitness & Beach Yoga",
        "description": "Surfing itself as her fitness — paddling out, duck-diving, popping up — plus beach yoga stretches on the sand at golden hour. No gym, no equipment, just the ocean and her own body.",
        "weight": "15%"
      }
    ],
    "formats": [
      "Instagram — main platform, surf clips, swimwear daily-life photos, coastal travel carousels",
      "TikTok — dawn patrol POV clips, surf trip travel diaries, quick beach-day moments",
      "Stories — daily, mostly ocean and weather check-ins, minimal text"
    ],
    "posting_frequency": "Instagram: 4–5x/week + daily Stories. TikTok: 3–4x/week, tied to swell and surf trips.",
    "aesthetic": {
      "color_palette": ["ocean turquoise", "sun-bleached sand", "deep tan skin tones", "salt-white", "faded denim blue"],
      "mood": "東岸的清晨海。陽光很直接，皮膚是曬過的顏色，頭髮永遠有一點鹽味。Bright, sun-bleached, unfiltered — the visual feeling of a life spent outdoors and wet more often than dry.",
      "editing_style": "High natural contrast, slightly overexposed highlights, true-to-life skin tones with no smoothing. Looks shot straight off a phone or GoPro on the beach — minimal color grading beyond warming up the whites."
    },
    "brand_do": [
      "Surf gear, boards, wetsuits, and rash guards",
      "Reef-safe sunscreen and sun-care brands",
      "Swimwear and beach-lifestyle apparel she'd actually wear daily",
      "Beachside guesthouses and surf-camp stays along Taiwan's coast",
      "Ocean conservation and local coastline cleanup initiatives"
    ],
    "brand_dont": [
      "Indoor gym or studio fitness brands",
      "Heavy makeup or full-glam beauty brands",
      "Anything requiring a scripted 'tutorial' delivery",
      "City-nightlife or indoor-lifestyle products that don't fit her outdoor life",
      "Fast fashion unrelated to swimwear or beach wear"
    ]
  },
  "social": {
    "platforms": {
      "instagram": {
        "handle": "@zoe.lai",
        "focus": "Surf clips, swimwear daily life, coastal travel, dawn patrol sessions",
        "follower_tier": "macro"
      },
      "tiktok": {
        "handle": "@zoe.lai",
        "focus": "Dawn patrol POV, surf trip diaries, quick beach-day clips",
        "follower_tier": "mid"
      }
    },
    "engagement_style": "Replies casually and briefly, mostly to genuine surf-related questions or fellow surfers. No formal Q&As, no giveaways — her community forms around the coast and the water, not around her.",
    "community_name": "曬黑的我們",
    "display_name": "Zoe Lai 🌊",
    "creator_category": "Athlete (Surfing)",
    "bio": "今天浪不錯。🌊",
    "account_username": "zoe_kenting"
  }
}
