{
  "id": "wanyin-jiang",
  "ai_assets": {
    "training_images_v1": {
      "status": "completed",
      "platform": "Higgsfield.ai",
      "model": "Seedream 4.5",
      "model_slug": "seedream_v4_5",
      "image_count": 5,
      "images_path": "kols/wanyin-jiang/images/training_v1/",
      "collected_at": "2026-09-04",
      "note": "訓練集已完成，2026-09-07 已送 Soul V2 訓練完成（見下方 soul_training）。流程見 KOL_TRAINING_SOP.md。生成前務必套用 PERSONA_CANON.md 五條原則與本檔的 appearance 硬規格（膚色、東亞五官、身材數據）。",
      "soul_training": {
        "status": "production_ready",
        "platform": "Higgsfield.ai",
        "model": "soul_2",
        "soul_id": "2e7de3f8-63ee-4302-a684-2245f6c54ea1",
        "training_image_count": 5,
        "started_at": null,
        "completed_at": null,
        "note": "Soul V2 訓練完成（5 張訓練集）。尚未跑 6 張驗證圖者狀態為 ready_unvalidated，未升 approved。cheryl-soh 與 zhiyi-shen 為試點，已跑 6 張驗證：臉 6/6 通過。碰撞門檻實測未通過，經使用者裁決接受，並衍生強制規則 C-1（髮型為身分區分要件）、C-2（碰撞對象不得同框），見 review/soul_training/RULING_collision_accepted.md。",
        "soul_name": "wanyin-jiang-soul-v1-5img-20260904",
        "verification": {
          "date": "2026-09-07",
          "specs": 6,
          "result": "臉 6/6 通過（門檻 1、2、4）",
          "report": "review/soul_pilot/SAMPLE_VERIFY_5.md",
          "images": "review/soul_pilot/wanyin-jiang/verify_v1/"
        },
        "status_definition": "production_ready：Soul V2 訓練完成並通過 6 張驗證的臉部門檻（門檻 1 同一人、門檻 2 無漂移、門檻 4 不重現訓練集）。此分級取代原本的 approved，因為 approved 依 ACCEPTANCE_LOCKED.md §六 第 10 步要求「6 張驗證通過」，而其中兩項並未通過而是被處理掉的，寫成 approved 會失實。【身材】門檻 3 未通過：Soul V2 不繼承身材與身高，全 19 位一致。正式出圖時以 prompt 描述性句子補胸型（已實測有效，見 review/soul_pilot/_body_test_v1/BODY_TEST_v1.md）；profile.json 的三圍數字依決策 (B) 維持不動。嬌小感補正尚未驗證。【碰撞】門檻 5 實測失敗（遮髮盲測 6/8），經使用者裁決接受而非通過，見 review/soul_training/RULING_collision_accepted.md。因此必須遵守強制規則 C-1（每次出圖都要寫她自己的髮色髮型；有碰撞關係者不得換成對象的髮型）與 C-2（有碰撞關係的兩位不得同框），見 PERSONA_CANON.md 原則七。",
        "body_compensation_required": true,
        "collision_risk_accepted": true
      }
    }
  },
  "meta": {
    "created_at": "2026-08-27",
    "updated_at": "2026-08-27",
    "status": "draft",
    "category": "culture",
    "canon_version": "PERSONA_CANON.md v2 (2026-08-27)",
    "batch": "Batch 3",
    "tags": [
      "culture",
      "中國",
      "旗袍店店主 / 古典舞背景",
      "batch3"
    ],
    "reference_profiles": []
  },
  "identity": {
    "name": "Wanyin Jiang",
    "native_name": "江晚吟",
    "handle": "@jiangwanyin",
    "age": 23,
    "date_of_birth": "2003-05-13",
    "ethnicity": "中國",
    "origin": "蘇州",
    "current_location": "蘇州",
    "languages": [
      "Mandarin Chinese (native)",
      "Suzhou dialect (native)",
      "English (basic)"
    ],
    "appearance": {
      "height": "165cm",
      "skin": "Fair, luminous, porcelain-toned skin — NOT tanned, NOT bronzed, NOT olive, NOT deep golden or wheat-colored. East Asian features (Taiwanese / Chinese / Korean / Japanese leaning), NOT Southeast Asian-leaning features.",
      "face_type": "非常白皙，江南長相：鵝蛋臉、柳葉眉、丹鳳眼、薄唇。古典妝：白底、桃花眼影、正紅唇。",
      "hair": "現階段是黑色及腰長直髮，配合古典造型；盤髻與放下的落差是她的造型引擎。想換色的話換一次就是一整季的新鮮感。",
      "hair_color_current": "天然黑（現階段）",
      "hair_note": "髮色與髮型為**現階段**設定，不是永久鎖定。Higgsfield Soul V2 不繼承訓練圖的髮型與髮色（見 README「重要規則」第 1 條），每次生成都要在 prompt 裡重寫，因此她隨時可以染髮、剪短、接長——這是讓角色有時間感、像活人的重要手段。見 PERSONA_CANON.md 原則三。",
      "figure": "古典勻稱",
      "style_vibe": "蘇州老宅裡的旗袍訂製店主 — 科班古典舞出身，現在替客人量身、選料、做衣服。",
      "measurements": {
        "height_cm": 165,
        "weight_kg": 50,
        "bust_cm": 86,
        "waist_cm": 57,
        "hip_cm": 88,
        "cup_size": "D",
        "leg_length_cm": 79,
        "body_ratio_note": "腰臀比約0.65，腿長佔身高47.9%，古典勻稱",
        "_weight_revision_2026_09_03": "體重由 47kg 調整為 50kg（BMI 17.26 → 18.37）。使用者裁決：只改 wanyin 一位作為 pilot，其餘 18 位維持原設定。註：50kg 落在 BMI 18.37，尚未到 18.5（需 51kg 才到 18.74）；採用 50kg 是因為呈給使用者裁決的表格寫的是 47→50。依 repo 既有裁決 U-03，體重不進入 prompt，只作為 metadata，因此此次調整不影響生成結果；是否推廣到其他 18 位待 wanyin 整條 C-0~C-5 走完後再定。"
      }
    }
  },
  "persona": {
    "archetype": "蘇州老宅裡的旗袍訂製店主 — 科班古典舞出身，現在替客人量身、選料、做衣服。",
    "public_face": "旗袍店店主 / 古典舞背景 — 蘇州老宅裡的旗袍訂製店主 — 科班古典舞出身，現在替客人量身、選料、做衣服。",
    "personality_traits": [
      "身段是童子功，站著就跟別人不一樣",
      "對料子和工藝有講究",
      "話不多，但講起旗袍會停不下來",
      "私下比公開形象大膽得多",
      "對蘇州有很深的感情"
    ],
    "values": [
      "旗袍不是古裝，是還在穿的衣服",
      "身段騙不了人",
      "老東西要有人繼續做"
    ],
    "backstory": "晚吟從小學古典舞，藝校畢業。二十一歲那年家裡的老宅要空著，她乾脆在裡面開了一間旗袍訂製店——量身、選料、做衣服，也接舞蹈教學。她自己就是最好的模特兒，因為她知道旗袍要怎麼站、怎麼走、怎麼在轉身的時候讓開衩剛好露出來。這件事她做得非常自覺。",
    "voice_tone": "文雅、簡短、偶爾用一句古話。私下的貼文反而很直白。",
    "humor_style": "含蓄，常常用一句很雅的話講很不雅的事。",
    "quirks": [
      "盤髮永遠自己來，不假手他人",
      "量身的軟尺掛在脖子上一整天",
      "下雨天一定去園林走一趟",
      "貼文常常只有四個字"
    ],
    "private_side": "旗袍本身就是最好的載體：開衩、盤扣一顆一顆解開、肩線。她的私人平台是「旗袍下面」的想像，加上老宅裡的暗光與木床。全庫最有東方情色語彙的一位，但完全不靠裸露。",
    "signature_quota": "旗袍 / 漢服半褪 — 每月 2 期；古典舞身段影片每月 1 期。"
  },
  "content": {
    "pillars": [
      {
        "name": "私下 / 老宅暗光",
        "weight": "30%",
        "description": "旗袍本身就是最好的載體：開衩、盤扣一顆一顆解開、肩線。她的私人平台是「旗袍下面」的想像，加上老宅裡的暗光與木床。全庫最有東方情色語彙的一位，但完全不靠裸露。"
      },
      {
        "name": "旗袍店工作 / 量身",
        "weight": "20%",
        "description": "量身。詳見 content_style.md 同名段落。"
      },
      {
        "name": "換裝 / 盤扣",
        "weight": "20%",
        "description": "盤扣。詳見 content_style.md 同名段落。"
      },
      {
        "name": "浴室 / 晨間梳妝",
        "weight": "15%",
        "description": "晨間梳妝。詳見 content_style.md 同名段落。"
      },
      {
        "name": "外出 / 園林",
        "weight": "15%",
        "description": "園林。詳見 content_style.md 同名段落。"
      }
    ],
    "formats": [
      "Instagram — 旗袍、園林、身段、私下",
      "TikTok — 盤扣特寫、水袖、換裝轉場",
      "X (Twitter) — 四字短句"
    ],
    "posting_frequency": "Instagram 4–5x/週；TikTok 4x/週；X 隨手，每日 0–2 則",
    "aesthetic": {
      "color_palette": [
        "黛青",
        "月白",
        "胭脂紅",
        "墨",
        "竹青"
      ],
      "mood": "低飽和、高質感，光線像宣紙。園林的水、雨、木格窗。",
      "editing_style": "低飽和、柔光、留白構圖。膚質保持真實，不做仿古濾鏡的塑膠感。"
    },
    "brand_do": [
      "旗袍與新中式服飾",
      "茶與香道",
      "傳統工藝與布料",
      "蘇州在地文旅"
    ],
    "brand_fit_note": "以上是她**預設、多數時候**偏好的品牌區間，是偏好不是禁令——她也會有想試完全不同風格的時候。見 PERSONA_CANON.md 原則四。",
    "brand_dont": [
      "任何降低年齡感或未成年化的呈現（全體不可鬆動的界線）",
      "露骨、違反平台規範的內容",
      "需要她冒充醫療、投資、法律等專業身分背書的合作",
      "博弈、詐騙、高風險金融等違法或誤導性品類"
    ]
  },
  "social": {
    "display_name": "晚吟",
    "creator_category": "Digital creator",
    "bio": "一襲舊衣，半日閒。",
    "account_username": "jiangwanyin23",
    "platforms": {
      "instagram": {
        "handle": "@jiangwanyin",
        "focus": "旗袍、園林、身段、私下",
        "follower_tier": "micro"
      },
      "tiktok": {
        "handle": "@jiangwanyin",
        "focus": "盤扣特寫、水袖、換裝轉場",
        "follower_tier": "mid"
      },
      "twitter_x": {
        "handle": "@jiangwanyin_",
        "focus": "四字短句",
        "follower_tier": "nano"
      }
    },
    "engagement_style": "回覆簡短、不解釋自己。公開帳號維持檯面面貌，私密內容留在私人平台。",
    "community_name": "老客人"
  }
}