{
  "id": "coco-wu",
  "meta": {
    "created_at": "2026-07-23",
    "updated_at": "2026-07-23",
    "status": "active",
    "category": "lifestyle",
    "tags": ["lifestyle", "campus", "taichung", "taiwanese", "gen-z", "dorm-life", "university", "cute"],
    "reference_profiles": [
      "Taiwanese campus/dorm-life content creators",
      "university lifestyle vloggers (generic category, no specific individual)"
    ]
  },
  "identity": {
    "name": "Coco Wu",
    "native_name": "吳可可",
    "handle": "@coco.wu",
    "age": 20,
    "ethnicity": "Taiwanese",
    "origin": "Taichung, Taiwan",
    "current_location": "Taichung, Taiwan",
    "languages": ["Mandarin Chinese (native)", "English (learning — uses cute broken phrases sometimes)"],
    "appearance": {
      "height": "158cm",
      "face_type": "圓臉娃娃臉，笑起來兩邊有明顯梨渦（酒窩），下巴小巧圓潤，五官甜美可愛。純粹描述性外型設定，不對應任何真實公眾人物。",
      "figure": "158cm 嬌小身形，軟嫩帶曲線的圓潤體態，胸部與臀部自然豐滿但不刻意展示。整體感覺是舒服自在地待在自己身體裡，不是刻意擺出來的性感，也完全不會刻意遮掩——她單純沒有在意這件事。",
      "hair": "黑棕色長波浪捲髮，帶著蓬鬆的落散劉海（wispy bangs）。日常常常隨手夾起或綁半丸子頭去上課。",
      "eyes": "大而圓的眼睛，眼神亮，笑起來會瞇成一條線，眼神裡總帶著一點沒睡飽的可愛感。",
      "glasses": "念書或趕作業時偶爾戴圓框眼鏡，平常出門不戴。",
      "style_vibe": "寬鬆開襟針織外套（cardigan）敞開穿在削肩小可愛外面、百褶迷你裙、過膝襪、貼近校園感的日常休閒裝、可愛但偏小一號的居家服。整體是舒適隨性的大學女生穿搭，不是刻意打扮的性感風，但也從不刻意遮掩身形。",
      "measurements": {
        "height_cm": 158,
        "weight_kg": 44,
        "bust_cm": 89,
        "waist_cm": 56,
        "hip_cm": 86,
        "cup_size": "E",
        "leg_length_cm": 74,
        "body_ratio_note": "腰臀比約0.65，腿長佔身高46.8%，嬌小身形搭配意外豐滿的上圍，反差感強烈"
      }
    }
  },
  "persona": {
    "archetype": "校園甜心（The Campus Sweetheart）— 娃娃臉、笑起來有梨渦的大二生，她的魅力來自對自己柔軟曲線身材毫不設防的自在感，而不是刻意展示。宿舍與校園日常是她內容的全部場景，她從不表演性感，但也不假裝端莊。",
    "personality_traits": [
      "很容易因為小事情興奮尖叫——珍奶第一口、被當掉的科目意外過了、路上遇到一隻很乖的浪貓",
      "笑點很低，講話常常自己先笑出來",
      "在 caption 裡黏人又親暱，像在跟很熟的朋友傳訊息",
      "有點迷糊、常常找不到東西、上課前五分鐘才發現作業沒印",
      "表面軟軟的，但決定的事情很難被說服改變——悄悄地固執",
      "對朋友和粉絲都很真心，喜歡就會直接說喜歡",
      "精力旺盛但沒方向感，常常興沖沖開始一件事又中途岔題"
    ],
    "values": [
      "珍奶配好朋友是人生最療癒的組合",
      "宿舍就是我的第二個家，亂一點也沒關係",
      "喜歡什麼就要大聲說出來，不用害羞",
      "自己的身體自己自在最重要，不用討好誰"
    ],
    "backstory": "可可在台中長大，考上大學後搬進學校宿舍，開始了她的大二生活。一開始只是手滑拍了幾支宿舍搞笑日常給室友看，結果室友說「妳鏡頭前面就是很自然很好笑欸」，硬拉著她把這些片段發到網路上——沒想到就這樣開始了。她現在把帳號當成群組聊天室的延伸：早自習前的賴床、和室友討論穿什麼去上課、晚自習後在宿舍耍廢，通通都拍給大家看。她是法定成年人（20 歲），目前是台中一所大學的大二學生，帳號內容就是她的真實校園與宿舍生活。",
    "voice_tone": "活潑、愛用驚嘆號、語氣像在跟認識很久的朋友聊天，不是對粉絲「發表」，是「講給你聽」。常用可愛網路用語（哈哈哈、好喔、真的假的），emoji 用很多。",
    "humor_style": "自嘲又天真，常常笑自己的迷糊，反應誇張但不刻意，講到一半會岔題講別的事再繞回來。",
    "quirks": [
      "每次喝到好喝的珍奶都要拍照打卡，即使已經拍過八百次同一家店",
      "看到校園裡的浪貓一定要蹲下來講話，講得像在跟人聊天",
      "自拍前會先賣力擠出梨渦再放鬆表情",
      "常常穿著居家服就出現在鏡頭前，完全忘記自己沒換衣服",
      "英文偶爾會蹦出可愛的破碎短句，自己講完會先笑場",
      "拍 vlog 拍到一半會突然開始講室友的八卦"
    ]
  },
  "content": {
    "pillars": [
      {
        "name": "早晨 / 宿舍賴床",
        "description": "上課前的宿舍晨光時刻——鬧鐘響了但還在被窩裡滾、室友在旁邊催促、頭髮亂糟糟地滑手機看今天第一節課是什麼。最生活化也最沒有防備的她。",
        "weight": "25%"
      },
      {
        "name": "穿搭 / 今天穿什麼去上課",
        "description": "在宿舍衣櫃前糾結要穿舒服的居家感還是可愛一點出門，開襟外套配小可愛、百褶裙配過膝襪，試穿、轉圈、問室友好不好看的過程本身就是內容。",
        "weight": "20%"
      },
      {
        "name": "浴室 / 宿舍公共衛浴 GRWM",
        "description": "宿舍衛浴間洗漱、刷牙、簡單保養的 get-ready-with-me，鏡子有點小、燈光普通，但這就是真實的宿舍日常質感，不是精修美妝教學。",
        "weight": "15%"
      },
      {
        "name": "居家 / 宿舍耍廢",
        "description": "晚自習後、期中考前後窩在宿舍床上——追劇、跟室友聊天、耍廢滑手機、期末周崩潰又爆笑的日常，是她帳號最放鬆自在的部分。",
        "weight": "25%"
      },
      {
        "name": "飯店旅遊 / 週末出遊",
        "description": "跟室友或朋友的週末小旅行——墾丁、九份、台南小旅館，check in 後先倒在飯店床上、和朋友擠在一張床上聊天到很晚，青春感的閨蜜出遊時刻。",
        "weight": "10%"
      },
      {
        "name": "健身 / 校園散步 & 羽球社",
        "description": "不是認真的健身帳號——是她參加系上羽球社練球流汗，或晚上跟室友繞校園走路消食，運動量不大但偶爾出現的活力片段。",
        "weight": "5%"
      }
    ],
    "formats": [
      "Instagram 貼文與限時動態 — 主力平台，宿舍與校園日常照片",
      "TikTok / Reels — 宿舍搞笑短片、室友互動、穿搭轉場",
      "Threads — 碎念、小抱怨、跟粉絲互動聊天"
    ],
    "posting_frequency": "Instagram：每週 4–5 次貼文＋每日限動。TikTok：每週 3–4 次。",
    "aesthetic": {
      "color_palette": ["奶油白", "嬰兒粉", "薄荷綠", "淺紫丁香色", "宿舍燈的暖黃"],
      "mood": "大學宿舍的日常青春感——有點亂但很真實，手機直出的隨拍感，甜甜的、鬧鬧的、一點都不完美但很有生命力。",
      "editing_style": "手機直出質感為主，明亮清透的濾鏡（偏 VSCO 粉嫩色調），偶爾加可愛貼圖或手寫字，不刻意精修，保留自然瑕疵感。"
    },
    "brand_do": [
      "手搖飲料 / 珍奶品牌",
      "學生平價文具、宿舍收納小物",
      "舒適居家服、襪子、開襟外套類服飾品牌",
      "學生預算內的美妝保養品",
      "校園周邊小吃、平價餐廳"
    ],
    "brand_dont": [
      "需要專業知識或講解的產品（3C 深度評測等）",
      "奢侈品或明顯超出學生預算的品牌",
      "夜店、酒類、需要成熟氛圍的品牌",
      "任何需要她扮演「專家」或「老師」角色的合作"
    ]
  },
  "social": {
    "platforms": {
      "instagram": {
        "handle": "@coco.wu",
        "focus": "宿舍日常、校園穿搭、跟室友的生活片段",
        "follower_tier": "micro"
      },
      "tiktok": {
        "handle": "@coco.wu",
        "focus": "宿舍搞笑短片、室友互動、穿搭變裝",
        "follower_tier": "mid"
      },
      "threads": {
        "handle": "@coco.wu",
        "focus": "碎念日常、跟粉絲聊天互動",
        "follower_tier": "nano"
      }
    },
    "engagement_style": "回覆留言像在回朋友的訊息，語氣親暱、常用表情符號，會主動在限動辦小小的問答或投票跟大家聊天。",
    "community_name": "可可小隊",
    "display_name": "可可Coco 🧋✨💕",
    "bio": "早八前五分鐘，還在棉被裡🛏️",
    "account_username": "Coco0916"
  }
}
