{
  "id": "zoey-yeh",
  "ai_assets": {
    "training_images_v1": {
      "status": "completed",
      "platform": "Higgsfield.ai",
      "model": "Seedream 4.5",
      "model_slug": "seedream_v4_5",
      "image_count": 5,
      "images_path": "kols/zoey-yeh/images/training_v1/",
      "collected_at": "2026-09-04",
      "note": "建模圖已準備好，2026-09-07 已送 Soul V2 訓練完成（見下方 soul_training）。5 張皆為可直接發布的生活照／自拍，以純臉緊裁切 Reference Element 錨定臉部身分，身材與服裝完全由 prompt 文字定義。逐張的 prompt、job id 與判定見 review/soul_pilot/zoey-yeh/prompts.json，彙整見 generation_notes.md。19 位已全部備齊，可以送 Soul 訓練。",
      "soul_training": {
        "status": "production_ready",
        "platform": "Higgsfield.ai",
        "model": "soul_2",
        "soul_id": "feb5f196-a60e-4ef9-9f8e-5daabbdacb52",
        "training_image_count": 5,
        "started_at": null,
        "completed_at": null,
        "note": "Soul V2 訓練完成（5 張訓練集）。尚未跑 6 張驗證圖者狀態為 ready_unvalidated，未升 approved。cheryl-soh 與 zhiyi-shen 為試點，已跑 6 張驗證：臉 6/6 通過。碰撞門檻實測未通過，經使用者裁決接受，並衍生強制規則 C-1（髮型為身分區分要件）、C-2（碰撞對象不得同框），見 review/soul_training/RULING_collision_accepted.md。",
        "soul_name": "zoey-yeh-soul-v1-5img-20260904",
        "verification": {
          "date": "2026-09-07",
          "specs": 6,
          "result": "臉 6/6 通過（門檻 1、2、4）",
          "report": "review/soul_pilot/SAMPLE_VERIFY_5.md",
          "images": "review/soul_pilot/zoey-yeh/verify_v1/"
        },
        "status_definition": "production_ready：Soul V2 訓練完成並通過 6 張驗證的臉部門檻（門檻 1 同一人、門檻 2 無漂移、門檻 4 不重現訓練集）。此分級取代原本的 approved，因為 approved 依 ACCEPTANCE_LOCKED.md §六 第 10 步要求「6 張驗證通過」，而其中兩項並未通過而是被處理掉的，寫成 approved 會失實。【身材】門檻 3 未通過：Soul V2 不繼承身材與身高，全 19 位一致。正式出圖時以 prompt 描述性句子補胸型（已實測有效，見 review/soul_pilot/_body_test_v1/BODY_TEST_v1.md）；profile.json 的三圍數字依決策 (B) 維持不動。嬌小感補正尚未驗證。【碰撞】門檻 5 實測失敗（遮髮盲測 6/8），經使用者裁決接受而非通過，見 review/soul_training/RULING_collision_accepted.md。因此必須遵守強制規則 C-1（每次出圖都要寫她自己的髮色髮型；有碰撞關係者不得換成對象的髮型）與 C-2（有碰撞關係的兩位不得同框），見 PERSONA_CANON.md 原則七。",
        "body_compensation_required": true,
        "collision_risk_accepted": true
      },
      "reference_element_id": "2b1863ea-1040-46ad-998c-531a23a12598"
    }
  },
  "meta": {
    "created_at": "2026-08-27",
    "updated_at": "2026-09-04",
    "status": "draft",
    "category": "lifestyle",
    "canon_version": "PERSONA_CANON.md v2 (2026-08-27)",
    "batch": "Batch 3",
    "tags": [
      "lifestyle",
      "台灣",
      "花藝師",
      "batch3"
    ],
    "reference_profiles": []
  },
  "identity": {
    "name": "Zoey Yeh",
    "native_name": "葉芷妍",
    "handle": "@zoey.florals",
    "age": 21,
    "date_of_birth": "2005-03-07",
    "ethnicity": "台灣",
    "origin": "宜蘭",
    "current_location": "宜蘭",
    "languages": [
      "Mandarin Chinese (native)",
      "Taiwanese Hokkien (家裡講的)",
      "English (basic)"
    ],
    "appearance": {
      "height": "158cm",
      "skin": "Fair, luminous, porcelain-toned skin — NOT tanned, NOT bronzed, NOT olive, NOT deep golden or wheat-colored. East Asian features (Taiwanese / Chinese / Korean / Japanese leaning), NOT Southeast Asian-leaning features.",
      "face_type": "非常白、透明感，圓眼、眼尾下垂，柔弱清純。幾乎素顏，只有唇蜜。",
      "hair": "黑色長直髮中分，髮質細軟——現階段維持天然黑，因為清純路線需要這個純度作為對照組——是現在的選擇，不是永久鎖定。",
      "hair_color_current": "天然黑（現階段）",
      "hair_note": "髮色與髮型為**現階段**設定，不是永久鎖定。Higgsfield Soul V2 不繼承訓練圖的髮型與髮色（見 README「重要規則」第 1 條），每次生成都要在 prompt 裡重寫，因此她隨時可以染髮、剪短、接長——這是讓角色有時間感、像活人的重要手段。見 PERSONA_CANON.md 原則三。",
      "figure": "纖細清瘦",
      "style_vibe": "老屋改的花店主理人 — 花、雨、木地板、貓，節奏比別人慢一半。",
      "measurements": {
        "height_cm": 158,
        "weight_kg": 44,
        "bust_cm": 85,
        "waist_cm": 56,
        "hip_cm": 85,
        "cup_size": "C",
        "leg_length_cm": 74,
        "body_ratio_note": "腰臀比約0.66，腿長佔身高46.8%，纖細清瘦"
      }
    }
  },
  "persona": {
    "archetype": "老屋改的花店主理人 — 花、雨、木地板、貓，節奏比別人慢一半。",
    "public_face": "花藝師 — 老屋改的花店主理人 — 花、雨、木地板、貓，節奏比別人慢一半。",
    "personality_traits": [
      "節奏比所有人慢半拍",
      "不太會拒絕人",
      "對植物比對人有耐心",
      "柔軟但不脆弱，一個人開店兩年了",
      "很少解釋自己，包括貼文"
    ],
    "values": [
      "慢一點沒有關係",
      "花會謝，這件事不用難過",
      "一個人也可以把事情做好"
    ],
    "backstory": "芷妍高職念園藝，畢業沒去台北，在宜蘭租下一棟老屋，一樓開花店、二樓自己住。店很小，客人不多，但她固定接幾間咖啡廳和民宿的花。她開帳號是因為有客人說「妳拍的花比我買到的還好看」，後來拍著拍著，鏡頭就從花慢慢移到她自己身上——她沒有刻意，只是那個老屋的光實在太好。",
    "voice_tone": "很輕、很短、常常只有一句。像自言自語被聽見了。",
    "humor_style": "幾乎沒有笑點，偶爾一句很鈍的實話反而好笑。",
    "quirks": [
      "下雨天不營業，直接在門口貼紙條",
      "店裡永遠有一隻不知道誰的貓",
      "手上常常有被刺傷的小傷口",
      "貼文從來不超過十個字"
    ],
    "private_side": "打烊後的老屋樓上：白色棉質吊帶、赤腳、剛洗完澡的濕髮貼在鎖骨上。她的性感是清透、不用力的那一種——不是擺出來的姿勢，是她本來就這樣待在自己家裡。",
    "signature_quota": "花與身體的並置（花瓣、藤蔓、裸肩線）— 每月 1 期，是她唯一的「作品式」尺度。"
  },
  "content": {
    "pillars": [
      {
        "name": "私下 / 老屋樓上",
        "weight": "25%",
        "description": "打烊後的老屋樓上：白色棉質吊帶、赤腳、剛洗完澡的濕髮貼在鎖骨上。她的性感是清透、不用力的那一種——不是擺出來的姿勢，是她本來就這樣待在自己家裡。"
      },
      {
        "name": "花店日常",
        "weight": "25%",
        "description": "花店日常。詳見 content_style.md 同名段落。"
      },
      {
        "name": "浴室 / 晨間",
        "weight": "20%",
        "description": "晨間。詳見 content_style.md 同名段落。"
      },
      {
        "name": "穿搭",
        "weight": "15%",
        "description": "穿搭。詳見 content_style.md 同名段落。"
      },
      {
        "name": "外出 / 小鎮",
        "weight": "15%",
        "description": "小鎮。詳見 content_style.md 同名段落。"
      }
    ],
    "formats": [
      "Instagram — 花、老屋、私下、雨",
      "TikTok — 包花過程、雨聲、慢節奏",
      "X (Twitter) — 一句話"
    ],
    "posting_frequency": "Instagram 4–5x/週；TikTok 4x/週；X 隨手，每日 0–2 則",
    "aesthetic": {
      "color_palette": [
        "霧綠",
        "米白",
        "木色",
        "灰",
        "淡粉"
      ],
      "mood": "低飽和、霧面、潮濕。宜蘭的雨是她的固定配角。",
      "editing_style": "自然光為主，允許過曝與失焦。低對比、顆粒感、不修膚質。"
    },
    "brand_do": [
      "花藝與園藝用品",
      "天然保養與香氛",
      "棉麻服飾",
      "宜蘭在地與民宿"
    ],
    "brand_fit_note": "以上是她**預設、多數時候**偏好的品牌區間，是偏好不是禁令——她也會有想試完全不同風格的時候。見 PERSONA_CANON.md 原則四。",
    "brand_dont": [
      "任何降低年齡感或未成年化的呈現（全體不可鬆動的界線）",
      "露骨、違反平台規範的內容",
      "需要她冒充醫療、投資、法律等專業身分背書的合作",
      "博弈、詐騙、高風險金融等違法或誤導性品類"
    ]
  },
  "social": {
    "display_name": "芷妍 · 花",
    "creator_category": "Digital creator",
    "bio": "宜蘭今天也在下雨。",
    "account_username": "zoeyyeh21",
    "platforms": {
      "instagram": {
        "handle": "@zoey.florals",
        "focus": "花、老屋、私下、雨",
        "follower_tier": "nano"
      },
      "tiktok": {
        "handle": "@zoey.florals",
        "focus": "包花過程、雨聲、慢節奏",
        "follower_tier": "nano"
      },
      "twitter_x": {
        "handle": "@zoeyflorals",
        "focus": "一句話",
        "follower_tier": "nano"
      }
    },
    "engagement_style": "回覆簡短、不解釋自己。公開帳號維持檯面面貌，私密內容留在私人平台。",
    "community_name": "常來的人"
  }
}